<?xml version="1.0" encoding="UTF-8"?>
<!DOCTYPE dict SYSTEM "dtd/mwetoolkit-dict.dtd">
<dict>
<entry entryid="32">
    <ngram><w pos="FW" /> <w pos="FW" /> </ngram>
</entry>
<entry entryid="33">
    <ngram><w pos="FW" /> <w pos="FW" /> <w pos="N" /> <w pos="N" /> </ngram>
</entry>
<entry entryid="34">
    <ngram><w pos="N" /> <w pos="A" /> <w pos="A" /> <w pos="N" /> </ngram>
</entry>
<entry entryid="35">
    <ngram><w pos="N" /> <w pos="A" /> <w pos="A" /> <w pos="N" /> <w pos="N" /> </ngram>
</entry>
<entry entryid="36">
    <ngram><w pos="N" /> <w pos="A" /> <w pos="N" /> </ngram>
</entry>
<entry entryid="37">
    <ngram><w pos="N" /> <w pos="A" /> <w pos="N" /> <w pos="N" /> </ngram>
</entry>
<entry entryid="38">
    <ngram><w pos="N" /> <w pos="A" /> <w pos="N" /> <w pos="N" /> <w pos="N" /> </ngram>
</entry>
<entry entryid="39">
    <ngram><w pos="N" /> <w pos="A" /> <w pos="N" /> <w pos="N" /> <w pos="N" /> <w pos="N" /> </ngram>
</entry>
<entry entryid="40">
    <ngram><w pos="N" /> <w pos="A" /> <w pos="N" /> <w pos="NUM" /> </ngram>
</entry>
<entry entryid="41">
    <ngram><w pos="N" /> <w pos="N" /> </ngram>
</entry>
<entry entryid="42">
    <ngram><w pos="N" /> <w pos="N" /> <w pos="A" /> <w pos="N" /> </ngram>
</entry>
<entry entryid="43">
    <ngram><w pos="N" /> <w pos="N" /> <w pos="A" /> <w pos="N" /> <w pos="N" /> </ngram>
</entry>
<entry entryid="44">
    <ngram><w pos="N" /> <w pos="N" /> <w pos="A" /> <w pos="N" /> <w pos="N" /> <w pos="N" /> </ngram>
</entry>
<entry entryid="45">
    <ngram><w pos="N" /> <w pos="N" /> <w pos="N" /> </ngram>
</entry>
<entry entryid="46">
    <ngram><w pos="N" /> <w pos="N" /> <w pos="N" /> <w pos="A" /> <w pos="N" /> </ngram>
</entry>
<entry entryid="47">
    <ngram><w pos="N" /> <w pos="N" /> <w pos="N" /> <w pos="N" /> </ngram>
</entry>
<entry entryid="48">
    <ngram><w pos="N" /> <w pos="N" /> <w pos="N" /> <w pos="N" /> <w pos="N" /> </ngram>
</entry>
<entry entryid="49">
    <ngram><w pos="N" /> <w pos="N" /> <w pos="N" /> <w pos="N" /> <w pos="N" /> <w pos="N" /> </ngram>
</entry>
<entry entryid="50">
    <ngram><w pos="N" /> <w pos="N" /> <w pos="N" /> <w pos="N" /> <w pos="NUM" /> </ngram>
</entry>
<entry entryid="51">
    <ngram><w pos="N" /> <w pos="N" /> <w pos="NUM" /> <w pos="N" /> </ngram>
</entry>
<entry entryid="52">
    <ngram><w pos="N" /> <w pos="N" /> <w pos="NUM" /> <w pos="N" /> <w pos="N" /> </ngram>
</entry>
<entry entryid="53">
    <ngram><w pos="N" /> <w pos="NUM" /> </ngram>
</entry>
<entry entryid="54">
    <ngram><w pos="N" /> <w pos="NUM" /> <w pos="N" /> <w pos="N" /> </ngram>
</entry>
<entry entryid="55">
    <ngram><w pos="N" /> <w pos="NUM" /> <w pos="N" /> <w pos="N" /> <w pos="N" /> </ngram>
</entry>
<entry entryid="56">
    <ngram><w pos="N" /> <w pos="NUM" /> <w pos="P" /> <w pos="NUM" /> </ngram>
</entry>
</dict>
